{
  "schemaVersion": 1,
  "asOf": "2026-08-11",
  "status": "provider_shortlist_complete_selection_gated",
  "purpose": "Evaluate current official documentation for managed protected-runtime candidates against Mythical's PR-001 boundary without selecting a provider, creating an account, configuring access, asserting price, or authorizing deployment.",
  "architectureClassRef": "PR-001",
  "decisionRefs": ["D-014", "D-017"],
  "riskRefs": ["R-007", "R-008", "R-011", "R-012", "R-013"],
  "workflowRefs": ["A-011", "A-016", "A-023", "A-030", "A-031", "A-035", "A-036"],
  "authority": {
    "providerSelectionAuthorized": false,
    "vendorAccountCreationAuthorized": false,
    "termsAcceptanceAuthorized": false,
    "credentialCreationAuthorized": false,
    "runtimeProvisioningAuthorized": false,
    "schedulerActivationAuthorized": false,
    "persistentStoreCreationAuthorized": false,
    "alertDeliveryAuthorized": false,
    "externalActionAuthorized": false,
    "spendAuthorized": false,
    "conversationIsAuthorization": false
  },
  "sourcePolicy": {
    "officialPrimaryDocumentationOnly": true,
    "marketingClaimsCountAsConfigurationEvidence": false,
    "documentedCapabilityCountsAsConfiguredControl": false,
    "missingEvidenceRemainsUnverified": true,
    "pricingMustBeVerifiedForExactRegionAndUsage": true,
    "termsPrivacySecurityAndDataRegionReviewRequired": true
  },
  "platformCapabilityRequirements": [
    { "id": "PC-001", "name": "Bounded ephemeral job execution", "requirement": "One task, concurrency one, timeout 120 seconds, retry zero, and ephemeral execution can be enforced." },
    { "id": "PC-002", "name": "Separate workload identities", "requirement": "Orchestrator, assurance, scheduler, and history writer can use distinct least-privilege non-human identities." },
    { "id": "PC-003", "name": "Separated scheduling", "requirement": "A scheduler identity can invoke only the approved content-addressed entry point and remain disabled by default." },
    { "id": "PC-004", "name": "Deny-by-default egress", "requirement": "Outbound traffic can be denied by default and any later allowlist is explicit, narrow, and tested." },
    { "id": "PC-005", "name": "Read-only source and ephemeral scratch", "requirement": "Source is immutable to the job and temporary output is destroyed after bounded evaluation." },
    { "id": "PC-006", "name": "Tamper-resistant minimal history", "requirement": "Content-addressed compact records can be retained without overwrite and with separate writer/readers." },
    { "id": "PC-007", "name": "Encrypted minimized observability", "requirement": "Logs and metrics are encrypted, access-controlled, retention-bounded, and exclude raw or sensitive payloads." },
    { "id": "PC-008", "name": "Authenticated exception route", "requirement": "High/critical exception delivery can authenticate the route and recipient, deduplicate, and fail visibly." },
    { "id": "PC-009", "name": "Secret lifecycle", "requirement": "Credential references use a managed secret boundary with scoped retrieval, rotation, revocation, and audit." },
    { "id": "PC-010", "name": "Metering and hard resource stop", "requirement": "Usage can be attributed and a tested technical stop prevents execution beyond approved zero-or-bounded limits." },
    { "id": "PC-011", "name": "Kill and revocation path", "requirement": "Operators can stop new work, terminate active work, revoke runtime identity, and preserve minimum evidence." },
    { "id": "PC-012", "name": "Recovery and replay resistance", "requirement": "History backup/restore, partial failure, stale configuration, clock drift, and replay can be tested." }
  ],
  "sources": [
    { "id": "SRC-GCP-001", "providerId": "PE-001", "title": "Create Cloud Run jobs", "url": "https://cloud.google.com/run/docs/create-jobs", "retrievedOn": "2026-08-11", "supports": ["PC-001"] },
    { "id": "SRC-GCP-002", "providerId": "PE-001", "title": "Cloud Run service identity", "url": "https://docs.cloud.google.com/run/docs/securing/service-identity", "retrievedOn": "2026-08-11", "supports": ["PC-002"] },
    { "id": "SRC-GCP-003", "providerId": "PE-001", "title": "Execute Cloud Run jobs on a schedule", "url": "https://docs.cloud.google.com/run/docs/execute/jobs-on-schedule", "retrievedOn": "2026-08-11", "supports": ["PC-003"] },
    { "id": "SRC-GCP-004", "providerId": "PE-001", "title": "Direct VPC egress for Cloud Run", "url": "https://docs.cloud.google.com/run/docs/configuring/vpc-direct-vpc", "retrievedOn": "2026-08-11", "supports": ["PC-004"] },
    { "id": "SRC-GCP-005", "providerId": "PE-001", "title": "Cloud Storage Bucket Lock", "url": "https://docs.cloud.google.com/storage/docs/bucket-lock", "retrievedOn": "2026-08-11", "supports": ["PC-006"] },
    { "id": "SRC-AWS-001", "providerId": "PE-002", "title": "Amazon ECS standalone tasks", "url": "https://docs.aws.amazon.com/AmazonECS/latest/developerguide/standalone-tasks.html", "retrievedOn": "2026-08-11", "supports": ["PC-001"] },
    { "id": "SRC-AWS-002", "providerId": "PE-002", "title": "Amazon ECS task IAM role", "url": "https://docs.aws.amazon.com/AmazonECS/latest/developerguide/task-iam-roles.html", "retrievedOn": "2026-08-11", "supports": ["PC-002"] },
    { "id": "SRC-AWS-003", "providerId": "PE-002", "title": "Schedule Amazon ECS tasks", "url": "https://docs.aws.amazon.com/AmazonECS/latest/developerguide/tasks-scheduled-eventbridge-scheduler.html", "retrievedOn": "2026-08-11", "supports": ["PC-003"] },
    { "id": "SRC-AWS-004", "providerId": "PE-002", "title": "Amazon S3 Object Lock", "url": "https://docs.aws.amazon.com/AmazonS3/latest/userguide/object-lock.html", "retrievedOn": "2026-08-11", "supports": ["PC-006"] },
    { "id": "SRC-AWS-005", "providerId": "PE-002", "title": "AWS Secrets Manager", "url": "https://docs.aws.amazon.com/secretsmanager/latest/userguide/intro.html", "retrievedOn": "2026-08-11", "supports": ["PC-009"] },
    { "id": "SRC-AWS-006", "providerId": "PE-002", "title": "AWS Budgets actions", "url": "https://docs.aws.amazon.com/cost-management/latest/userguide/budgets-controls.html", "retrievedOn": "2026-08-11", "supports": ["PC-010"] },
    { "id": "SRC-GH-001", "providerId": "PE-003", "title": "GitHub Actions OpenID Connect reference", "url": "https://docs.github.com/en/actions/reference/security/oidc", "retrievedOn": "2026-08-11", "supports": ["PC-002"] },
    { "id": "SRC-GH-002", "providerId": "PE-003", "title": "GitHub Actions concurrency", "url": "https://docs.github.com/en/actions/concepts/workflows-and-actions/concurrency", "retrievedOn": "2026-08-11", "supports": ["PC-001"] },
    { "id": "SRC-GH-003", "providerId": "PE-003", "title": "GitHub Actions deployments and environments", "url": "https://docs.github.com/en/actions/reference/workflows-and-actions/deployments-and-environments", "retrievedOn": "2026-08-11", "supports": [] }
  ],
  "candidates": [
    {
      "id": "PE-001",
      "provider": "Google Cloud",
      "runtimeStack": "Cloud Run Jobs plus Cloud Scheduler, user-managed service accounts, controlled VPC egress, and protected Cloud Storage",
      "fitClass": "recommended_for_next_review_not_selected",
      "nextReviewRank": 1,
      "recommendedForNextReview": true,
      "documentedCapabilityIds": ["PC-001", "PC-002", "PC-003", "PC-004", "PC-006"],
      "unverifiedRequirementIds": ["PC-005", "PC-007", "PC-008", "PC-009", "PC-010", "PC-011", "PC-012"],
      "sourceRefs": ["SRC-GCP-001", "SRC-GCP-002", "SRC-GCP-003", "SRC-GCP-004", "SRC-GCP-005"],
      "strengths": ["Job-native bounded execution with configurable timeout, retries, task count, and parallelism", "Separate job and scheduler service identities are documented", "VPC egress controls and retention-locked object storage provide a credible route to isolation and protected history"],
      "knownConstraints": ["Deny-all egress must be designed and tested rather than inferred from VPC attachment", "Independent assurance, log minimization, alerts, secret rotation, spend hard stop, kill behavior, and recovery remain configuration evidence gaps", "Region, data processing terms, security posture, exact pricing, account ownership, and exit path are unreviewed"],
      "accountObserved": false,
      "pricingVerified": false,
      "securityReviewCompleted": false,
      "privacyReviewCompleted": false,
      "termsReviewCompleted": false,
      "dataRegionVerified": false,
      "providerSelected": false,
      "activationReady": false
    },
    {
      "id": "PE-002",
      "provider": "Amazon Web Services",
      "runtimeStack": "ECS standalone tasks on Fargate plus EventBridge Scheduler, task roles, S3 Object Lock, Secrets Manager, and AWS Budgets",
      "fitClass": "credible_higher_complexity_alternative",
      "nextReviewRank": 2,
      "recommendedForNextReview": false,
      "documentedCapabilityIds": ["PC-001", "PC-002", "PC-003", "PC-006", "PC-009", "PC-010"],
      "unverifiedRequirementIds": ["PC-004", "PC-005", "PC-007", "PC-008", "PC-011", "PC-012"],
      "sourceRefs": ["SRC-AWS-001", "SRC-AWS-002", "SRC-AWS-003", "SRC-AWS-004", "SRC-AWS-005", "SRC-AWS-006"],
      "strengths": ["Fargate tasks provide a distinct isolation boundary and task roles separate application permissions from execution permissions", "EventBridge supports separately permissioned scheduling", "WORM storage, managed secrets, and budget actions provide strong component options"],
      "knownConstraints": ["More components and IAM relationships increase configuration, review, recovery, and operator burden", "Network deny, immutable source, log minimization, alert failure, active-run kill, and replay controls remain unverified", "Region, data processing terms, security posture, exact pricing, account ownership, and exit path are unreviewed"],
      "accountObserved": false,
      "pricingVerified": false,
      "securityReviewCompleted": false,
      "privacyReviewCompleted": false,
      "termsReviewCompleted": false,